### ISSUE TITLE
[Bug]: Why is this addon communicating with www.baidu.com

### ISSUE THREAD

**Issue by del13r** [iHost-Open-Source-Project/hassio-ihost-addon#45]
### Add-on Name

eWeLink Smart Home

### Problem Description

This specific addon is communicating every 30 seconds with www.baidu.com
May I ask why this is the case?

### Logs

➜  ~ tcpdump port 53 | grep -e "baidu" -e "shifen"

```
17:02:19.151709 IP HomeAssistant.local.48730 > OPNsense.local.53: 61258+ A? www.baidu.com. (31)
17:02:19.152590 IP HomeAssistant.local.52884 > OPNsense.local.53: 12041+ AAAA? www.baidu.com. (31)
17:02:19.190991 IP OPNsense.local.53 > HomeAssistant.local.52884: 12041 2/1/0 CNAME www.a.shifen.com., CNAME www.wshifen.com. (141)
17:02:19.222719 IP OPNsense.local.53 > HomeAssistant.local.48730: 61258 4/0/0 CNAME www.a.shifen.com., CNAME www.wshifen.com., A 103.235.46.102, A 103.235.46.115 (116)

17:02:49.153491 IP HomeAssistant.local.51102 > OPNsense.local.53: 42397+ A? www.baidu.com. (31)
17:02:49.153592 IP HomeAssistant.local.55554 > OPNsense.local.53: 8579+ AAAA? www.baidu.com. (31)
17:02:49.205019 IP OPNsense.local.53 > HomeAssistant.local.55554: 8579 2/1/0 CNAME www.a.shifen.com., CNAME www.wshifen.com. (141)
17:02:49.215926 IP OPNsense.local.53 > HomeAssistant.local.51102: 42397 4/0/0 CNAME www.a.shifen.com., CNAME www.wshifen.com., A 103.235.46.102, A 103.235.46.115 (116)
```

➜  ~ tcpdump port 53 -v | grep -e "baidu" -e "shifen"

    HomeAssistant.local.45089 > OPNsense.local.53: 3991+ AAAA? www.baidu.com. (31)
    HomeAssistant.local.59924 > OPNsense.local.53: 6291+ A? www.baidu.com. (31)
    OPNsense.local.53 > HomeAssistant.local.45089: 3991 2/1/0 www.baidu.com. CNAME www.a.shifen.com., www.a.shifen.com. CNAME www.wshifen.com. (141)
    OPNsense.local.53 > HomeAssistant.local.59924: 6291 4/0/0 www.baidu.com. CNAME www.a.shifen.com., www.a.shifen.com. CNAME www.wshifen.com., www.wshifen.com. A 103.235.46.102, www.wshifen.com. A 103.235.46.115 (116)

    HomeAssistant.local.54058 > OPNsense.local.53: 58355+ AAAA? www.baidu.com. (31)
    HomeAssistant.local.48687 > OPNsense.local.53: 6808+ A? www.baidu.com. (31)
    OPNsense.local.53 > HomeAssistant.local.48687: 6808 4/0/0 www.baidu.com. CNAME www.a.shifen.com., www.a.shifen.com. CNAME www.wshifen.com., www.wshifen.com. A 103.235.46.102, www.wshifen.com. A 103.235.46.115 (116)
    OPNsense.local.53 > HomeAssistant.local.54058: 58355 2/1/0 www.baidu.com. CNAME www.a.shifen.com., www.a.shifen.com. CNAME www.wshifen.com. (141)

<img width="1841" height="371" alt="Image" src="https://github.com/user-attachments/assets/79f1065d-486e-4123-9b36-d3dd94cc2362" />

### Steps to Reproduce (Optional)

Stop the addon and the DNS requests stop

**Comment by SuiKaSan** [comment]
This is not a bug, but one of the mechanisms we use to detect external network connectivity.
If this has caused you any inconvenience, we will adopt an alternative detection method in the next version.
We sincerely apologize for the disruption.

**Comment by del13r** [comment]
Can you show where in the code this is defined?
